姓名,年龄,工作经验,学历,当前状态,期望地点,期望职位,期望薪资,最近公司,最近职位,评分,是否达标,评价建议,使用模板,分享链接,分析时间
林本聪,31,随时到岗,未知,未知,深圳技术总监,未知,未知,一脉通,深圳,0,否,简历中未提及硬件经理或硬件主管职位，也未出现相关关键词，建议招聘人考虑其他候选人,硬件经理,无,2025/7/26 16:00
李辉,32,随时到岗,本科,离职-随时到岗,深圳,技术总监/副总裁/经理VP,未知,博安通物联科技洛阳股份公司,副总裁/理VP,0,否,该简历不符合硬件经理或硬件主管的岗位要求，建议不予考虑,硬件经理,无,2025/7/26 16:00
董志,33,随时到岗,未知,未知,深圳技术总监,未知,未知,维森软件研发经理,未知,0,否,该简历不符合硬件经理或硬件主管岗位要求，建议不考虑,硬件经理,无,2025/7/26 16:01
王勇,34,考虑机会,未知,未知,深圳技术总监,未知,未知,埃芯半导体硬件经理,未知,0,否,简历中未提及与智能穿戴相关的经验或技能，建议进一步确认候选人是否具备相关行业背景或技能。,硬件经理,无,2025/7/26 16:02
方勇,35,考虑机会,大专,在职-考虑机会,深圳,"技术总监, 硬件工程师",未知,深圳市金英拓联科技有限公司,硬件理・部,0,否,该简历不符合硬件经理或硬件主管的岗位要求，建议不予考虑。,硬件经理,无,2025/7/26 16:03
廖俊龙,36,随时到岗,未知,未知,深圳技术总监,未知,未知,SKG未来穿戴健康研发总监,未知,0,否,简历不符合硬件经理或硬件主管的岗位要求，建议不考虑,硬件经理,无,2025/7/26 16:04
林鹏,37,月内到岗,未知,未知,深圳技术总监,未知,未知,斯远电子产品线负责人,未知,0,否,该简历不满足硬件经理或硬件主管的岗位要求，建议不考虑,硬件经理,无,2025/7/26 16:05
樊先生,38,月内到岗,未知,未知,深圳技术总监,未知,未知,金泰谊电子MBB研发总监,未知,0,否,简历中未提及硬件经理或硬件主管相关职位，且缺乏关键词匹配，建议不予考虑,硬件经理,无,2025/7/26 16:07
